{
  "schemaVersion": "1.0.0",
  "status": "approved",
  "inventory": "analysis/table-plugins/inventory.json",
  "evidenceRevision": "sha256:cbb2adf11daaa6aaaef5126eb865db625e40877722df37618e2c19c028f5a146",
  "methodology": "Rank repository-evidenced product need first, then React Aria compatibility, accessibility risk, explicit 1k/10k requirements, and implementation/migration/maintenance cost. Mandatory prototypes receive no automatic rank bonus.",
  "prototypeCandidates": ["selection", "sorting"],
  "records": [
    {
      "candidate": "sorting",
      "demandEvidence": [
        {
          "source": "analysis/gap-analysis-astryx/plans/prioritized-roadmap-implementation-plan.md#table-inventory-and-ranking-contract",
          "claim": "The approved roadmap requires sorting and first-class server-side sorting."
        },
        {
          "source": "docs/components/table.md#with-sorting",
          "claim": "The current public Table already documents controlled sorting."
        }
      ],
      "reactAriaCompatibility": "React Aria Table natively accepts sortDescriptor/onSortChange and Column allowsSorting.",
      "accessibilityRisks": [
        "Sort direction must remain announced by React Aria.",
        "Server refreshes must retain focus and stable column IDs."
      ],
      "stateModel": "One SortDescriptor in the shared controller; every change increments the table query revision.",
      "controlledUncontrolled": "Support controlled sortDescriptor and defaultSortDescriptor without mirroring controlled state.",
      "clientServer": "Client mode uses a stable comparator; server mode publishes the same descriptor with cancellation and stale-result rejection.",
      "ssrHydration": "The initial descriptor and column IDs must be deterministic on server and client.",
      "performance": {
        "rows1k": "Measure stable local O(n log n) sorting; server mode remains available.",
        "rows10k": "Prefer server sorting or deliberate memoized local sorting; capture both before promotion."
      },
      "cost": {
        "implementation": "Low: current Table and React Aria already expose the state contract.",
        "migration": "Low: existing direct sort props remain supported.",
        "maintenance": "Low: preserve React Aria descriptors and avoid a second sorting model."
      },
      "disposition": "approve",
      "rank": 1,
      "rankingRationale": "Existing public behavior plus an explicit server-side roadmap requirement makes sorting the strongest incremental plugin candidate.",
      "evidenceDigest": "sha256:8ec33a96d63005fe869f16322323c39ec7f1b9bf83e95ef627ae05d5d825f572"
    },
    {
      "candidate": "selection",
      "demandEvidence": [
        {
          "source": "analysis/gap-analysis-astryx/plans/prioritized-roadmap-implementation-plan.md#table-inventory-and-ranking-contract",
          "claim": "The approved roadmap requires selection in the plugin research scope."
        },
        {
          "source": "docs/components/table.md#with-selection",
          "claim": "The current public Table documents React Aria selection modes."
        }
      ],
      "reactAriaCompatibility": "React Aria Table natively owns selectedKeys/onSelectionChange, selection modes, and keyboard semantics.",
      "accessibilityRisks": [
        "Selection cannot be duplicated outside React Aria state.",
        "Bulk selection and disabled rows require accurate announcements."
      ],
      "stateModel": "One React Aria Selection value in the shared controller with stable row keys.",
      "controlledUncontrolled": "Support controlled selectedKeys and defaultSelectedKeys; controlled values remain authoritative.",
      "clientServer": "Selection is local identity state while server queries may consume the selected key snapshot.",
      "ssrHydration": "Default selection and row IDs must match across server render and hydration.",
      "performance": {
        "rows1k": "Measure Set cloning and membership without scanning every row.",
        "rows10k": "Use key-based selection and the React Aria all-selection sentinel rather than materializing all keys."
      },
      "cost": {
        "implementation": "Low: React Aria already supplies selection behavior.",
        "migration": "Low: direct selection props map to controller root props.",
        "maintenance": "Low: retain React Aria Selection as the only representation."
      },
      "disposition": "approve",
      "rank": 2,
      "rankingRationale": "Selection already exists publicly and can validate shared-state composition without replacing accessible interaction behavior.",
      "evidenceDigest": "sha256:998cafa55df4c99d6de8d03d3ea593d234c9926e3288da9c3a8aed0ce11cdf4b"
    },
    {
      "candidate": "pagination",
      "demandEvidence": [
        {
          "source": "analysis/gap-analysis-astryx/plans/prioritized-roadmap-implementation-plan.md#table-inventory-and-ranking-contract",
          "claim": "The roadmap explicitly requires first-class server-side pagination."
        },
        {
          "source": "packages/react/src/pagination/Pagination.styled.tsx",
          "claim": "Tale UI already has an accessible standalone Pagination component available for composition."
        }
      ],
      "reactAriaCompatibility": "Pagination composes outside Table without replacing table semantics; the controller supplies page query state.",
      "accessibilityRisks": [
        "Page changes must move or preserve focus intentionally.",
        "Row counts and current page state require accessible labels."
      ],
      "stateModel": "Page, page size, known/unknown total, and query revision belong to the shared controller.",
      "controlledUncontrolled": "Support controlled page/pageSize and deterministic defaults.",
      "clientServer": "Client mode slices a stable row set; server mode treats page changes as cancellable correlated requests.",
      "ssrHydration": "Initial page and page size must be identical during SSR and hydration.",
      "performance": {
        "rows1k": "Client slicing is bounded by page size and should not copy unrelated rows.",
        "rows10k": "Server pagination is the default performance path when a backend is available."
      },
      "cost": {
        "implementation": "Medium: integrate query state with the existing Pagination component.",
        "migration": "Low: standalone Pagination compositions can move handlers into the controller.",
        "maintenance": "Medium: support unknown totals and server response correlation."
      },
      "disposition": "approve",
      "rank": 3,
      "rankingRationale": "The roadmap explicitly requires server pagination and Tale UI already owns the visual navigation primitive.",
      "evidenceDigest": "sha256:167998525c49802ee1eb25929d06aad929c678a8d748f52b3d9efc4caaa9aa7a"
    },
    {
      "candidate": "filtering",
      "demandEvidence": [
        {
          "source": "analysis/gap-analysis-astryx/plans/prioritized-roadmap-implementation-plan.md#table-inventory-and-ranking-contract",
          "claim": "The roadmap explicitly requires first-class server-side filtering."
        }
      ],
      "reactAriaCompatibility": "Filtering is external query state and can change Table.Body rows without changing React Aria table semantics.",
      "accessibilityRisks": [
        "Result changes need count/status announcements without excessive live-region noise.",
        "Focus must be reconciled when the focused row is filtered out."
      ],
      "stateModel": "A versioned filter expression joins sorting and pagination in the shared query snapshot.",
      "controlledUncontrolled": "Support controlled filters and deterministic default filters; schema design precedes public promotion.",
      "clientServer": "Client predicates and server expressions share revision/cancellation behavior but not executable serialization.",
      "ssrHydration": "Default filters and their resulting initial rows must be server/client deterministic.",
      "performance": {
        "rows1k": "Measure predicate cost and avoid recomputation for unrelated state.",
        "rows10k": "Prefer server filtering or an explicitly benchmarked indexed client strategy."
      },
      "cost": {
        "implementation": "Medium: define a non-executable filter model and result announcements.",
        "migration": "Medium: existing ad hoc predicates need explicit adapters.",
        "maintenance": "Medium: client and server operators require compatibility discipline."
      },
      "disposition": "approve",
      "rank": 4,
      "rankingRationale": "Filtering is a named server-side acceptance requirement and must share request state with sorting and pagination.",
      "evidenceDigest": "sha256:7367acd4b95d5fc5744da817d2457b9eb03a0ad3253681ab97fa2fa7b6e0ed1c"
    },
    {
      "candidate": "virtualization",
      "demandEvidence": [
        {
          "source": "analysis/gap-analysis-astryx/plans/prioritized-roadmap-implementation-plan.md#table-inventory-and-ranking-contract",
          "claim": "The roadmap requires virtualization research and 1k/10k benchmarks."
        },
        {
          "source": "packages/react/src/virtualizer/index.ts",
          "claim": "Tale UI already exposes React Aria Virtualizer primitives."
        }
      ],
      "reactAriaCompatibility": "React Aria virtualization primitives exist, but Table integration and collection semantics require a dedicated prototype.",
      "accessibilityRisks": [
        "Unmounted offscreen rows can change screen-reader browsing and row count expectations.",
        "Focus restoration and virtualized measurement must survive zoom and dynamic content."
      ],
      "stateModel": "Viewport and measurement state is plugin-local while row identity and query revision remain controller-owned.",